Language Code,Stopwords
zh,"呃, 也是, 不独, 进步, 略加, 从此以后, 及其, 累次, ^, Ψ, 一则, 已, 大不了, 各, ［①ｈ］, 慢说, 出, 如下, 庶几, /, 以来, &, 过去, 虽, 毫不, 要么, 啷当, 后来, ０：２, ［⑤］］, 大多数, 挨门逐户, 总是, 已矣, 这么样, 可, 乒, 从不, 此后, 遇到, 来讲, 除开, 并不是, 後面, 到头来, 故意, 对比, 着, 它是, 被, 乘虚, 下去, :, 别说, 以外, 多年前, 整个, 从今以后, 咦, 又, 或则, 出来, 除了, 按照, 或许, 全部, 应当, 不管怎样, 总的来看, ［③⑩］, 基于, ∪φ∈, 俺们, 一切, 巴, 且, 这样, 梆, 它的, 岂但, 不止一次, 都, 起来, （, 进而, },, 不论, 屡, 没, 以, 应该, 抑或, 该, 恐怕, 上来, ＿, 而外, 何处, 这会儿, １．, 不巧, 您是, 本, ［①ａ］, 哦, 反映, sub, 何乐而不为, 全体, 当头, 趁机, 不满, ￥, 满, 若果, 立, 大, 采取, 惯常, 怎么样, 不成, 阿, $, 』, 还是, 暗中, 确定, 表示, 最大, 呵, 以故, ７, 为此, 趁热, 千万千万, 首先, 处理, 而且, 如上所述, 传闻, 挨门挨户, 则, 代替, 赶快, －［＊］－, %, 各个, 不再, 当即, 基本, 何况, 恰恰相反, 要不, 当地, 过, 弗, 且不说, ［②, 方能, 因着, 此地, 不足, 呢, 跟, 要不是, 顷, ’‘, 某个, 甫, 不必, 简言之, 何须, ［③Ｆ］, 之所以, 十分, 从严, 各级, 考虑, 扑通, 反而, 并, 这么点儿, ④, 一转眼, 相同, 他人, 既往, 当, 每当, ..., ［②ｉ］, 挨次, 到, 如其, 八成, 有些, ⑧, 轰然, 能够, 不至于, 小, 恰好, 前者, 强烈, 暗自, 刚巧, 个人, ′∈, 光, 凭, ［②④, 切不可, 表明, 譬如, 行为, 大概, ,, μ, 当然, 否则, 起见, ［①ｅ］, 亲口, 适用, 如若, 不常, 争取, 几乎, 再其次, 但是, 等到, 如常, 不可抗拒, --, 来看, 连, |, 纵令, 从未, 所有, 本着, 拦腰, 纵使, 起先, ［②ａ］, 认识, 原来, ．, 即, 紧接着, 几经, 猛然, 随著, ＜, 你的, 每天, 毕竟, 隔夜, 毫无保留地, 从事, 〔, ［①②］, ［④］, 遵照, 元／吨, ──, 倒不如, 按说, 哼, 遵循, 么, ［③］, 几时, 不止, 六, 维持, 从速, 啪达, 接着, 认为, 并无, 正在, 准备, ［②⑧］, 那末, 愤然, 当着, 陈年, 既...又, 莫非, 存心, 总结, 屡次, ［②ｃ］, 今年, 恰巧, 较比, 常, 绝非, 避免, 于是乎, 权时, 要, ３, 与此同时, 必将, 随, 进来, 常言说得好, 〕〔, 乃至于, ［⑥］, 分期分批, 加之, 为什麽, 甭, ＜＜, 〉, 今后, ［①Ａ］, 哎呀, ｝, 惟其, 可以, ＋, 扩大, 不够, 凡是, ［③ａ］, 尽心竭力, 别, 加入, 逐步, 吧, 绝对, 得天独厚, 即如, 以至, 不但, 怎奈, 不是, 至若, 继后, 下面, 为止, 趁便, 尽可能, 叮咚, 我是, 于, 居然, 哪儿, 设若, 全都, 至于, 重新, ＞λ, 而已, 那么, ＺＸＦＩＴＬ, 这种, 获得, 二话没说, 就是了, 由此, 一致, 诸位, 最後, 果真, 允许, 独, 会, 岂非, 白, 为着, ［⑤ｂ］, 不比, 正巧, 看来, 只, 之前, 敞开儿, 掌握, 呼啦, 一直, 成为, ＝, 岂止, 『, ［②③］, 反倒是, 尽快, 不, 乘势, 一起, ［④ｄ］, 窃, 到底, 这些, ://, 企图, 所, 人人, 譬喻, 某些, 略为, 只限, 由于, 即刻, 四, 哈, 经过, ％, 如是, 的确, 来着, 常言说, 默然, 更进一步, 不妨, ｝＞, 将, 迫于, 由是, 何时, 诸, 打, 难得, 看, ２．３％, 随时, 用来, 一次, 」, γ, ＝″, ／, 即将, 恰恰, 比照, 除此, ?, 刚好, 促进, 不同, 自个儿, 使用, 有的, 其后, 合理, ［②ｈ］, 3, 那儿, 大批, 经, 全面, 总的来说, ９, 哩, 重要, 给, 赶早不赶晚, 暗地里, 所幸, 有及, 转变, 从古到今, 如此, 必要, 以免, 显著, 具体地说, 规定, 理该, 决不, 一来, 各种, 但, 召开, 伙同, ４, 仅, 喽, 同, 矣乎, 不只, 此处, 有着, 用, 来说, 一, 以下, 之一, 其次, 何以, 左右, ：, 需要, 临到, 甚或, 此中, 二话不说, 自家, 待, 全然, 依据, 此次, 路经, 仍, 趁着, 累年, 遭到, ８, 曾, 定, 前此, ｎｇ昉, ［③①］, 巩固, 亲眼, 不变, 急匆匆, 冲, 没奈何, 来得及, 广泛, 你们, 最近, ②, 不消, 挨家挨户, 不惟, ［③ｂ］, 是, 活, 历, >, 老是, 不免, 从无到有, 就算, 大举, 即便, *, 内, 除此而外, 严重, 主张, 对, ［⑦］, ＞, 呼哧, 哪样, 先生, 转贴, 究竟, .日, 一般, ［①④］, 范围, 我的, 咱们, 不能, 汝, 根据, 借此, 2, 组成, 上述, 处处, 仍旧, 嘎, 诚如, 但凡, 当中, ［②①］, 共, 策略地, 按时, 切勿, 从早到晚, 无论, ［②ｅ］, 殆, 将近, 更为, 别处, 不若, 前面, 一样, 抽冷子, 这么, 呵呵, 地, 对待, 谁, 嗡, ［⑤ｄ］, 明确, 就要, 倍感, 别的, ，, 顺, 直到, 倘若, 不胜, 不大, 极, 莫, 反应, 看到, ｆ］, 也, →, 为什么, ［③ｇ］, 嘿, 不可, 敢情, ·, 弹指之间, 替代, 那麽, 其中, 甚且, 余外, 恰似, 还要, ’, 帮助, 倘然, 倘使, 分别, 【, 不久, 我, 等, 还有, 尽然, 、, 互相, 即令, 转动, 下, 另方面, 由此可见, 嗬, 那会儿, 哎哟, 极为, 却不, ［④ｃ］, 强调, 不曾, 不如, -, ［］, 数/, 先后, 宣布, 反过来, 纵, 若非, 啥, 高兴, 进行, 处在, －β, 以上, 不迭, 彼此, 哪天, 从来, 别管, 0, 极端, 三, 为主, 呐, 朝着, 凭借, 非特, 取道, 咋, 反之, 由, 最好, 特点, 嘛, 中间, 多多少少, 似的, 必, 真是, 具体, 大大, 好象, 何苦, 呸, 问题, 几, 要是, 因为, //, 致, 不拘, 请勿, ［⑤］, 嘎嘎, 一定, ”, ｂ］, 到处, 近年来, 结果, 这时, 倒不如说, 继续, 乎, 差一点, 他, 出于, 穷年累月, 却, 多少, ６, 串行, ］, 因而, ［②ｂ］, 这就是说, 每逢, 如同, 就是说, 匆匆, 来不及, 粗, 不光, 很多, 比起, 若夫, 着呢, 庶乎, 存在, ①, ［①③］, 截至, 根本, 老大, 乘隙, 分头, 奈, 我们, 距, 有点, 齐, 便于, 不少, 的话, 彼, 某, 非常, 相应, 极力, 只当, 6, 不下, 对方, 宁肯, 勃然, 少数, 不外乎, 连日来, 凡, 容易, 故而, 叫, 奇, ［③ｃ］, 然则, 当口儿, 敢, 藉以, 其它, 大力, 极大, 大事, 哪些, 最高, 互, 偶尔, 比方, 接下来, 虽然, 呀, 难道说, 明显, 连同, 多次, 就是, 在, 其二, ▲, 不然, 沿, 顷刻之间, 多么, 而况, 有所, 何止, 怪, +, 他们, <, 不了, 够瞧的, 在下, 积极, 千万, 朝, 归齐, 并且, 清楚, 故, ［①Ｂ］, 如今, 越是, 突然, 一些, 到了儿, 怕, 带, 另一个, 达旦, 认真, 必须, 有效, 大多, 今, 果然, 因, 兮, 屡次三番, 将要, 唉, 固, 适当, 所以, 全年, 然, 如何, 嘻, ［⑤ｅ］, 反倒, 这儿, 坚持, "", 不日, 个, 各人, 得起, 重大, 离, 快要, 1, 公然, 偶而, 替, 吗, 形成, 般的, 靠, 乘机, 设使, 看样子, 焉, 显然, 猛然间, 其实, 挨着, 竟而, 等等, 安全, 较之, 别是, ℃, ＋＋, 甚而, 自, 以为, ａ］, 岂, 大略, 适应, 也就是说, 继之, ⑩, 犹自, 并肩, 怎么办, 中小, 实现, 近, 各自, .., 乘胜, 多数, 沿着, ～, 是以, －－, 刚才, 以後, 什么样, 某某, 啊, ］［, 而又, 不过, 非但, ？, 欤, 日益, 概, 大都, 接连不断, 怎样, 附近, 对于, ＜φ, 这般, 难道, 连连, 漫说, 千, 顺着, ［①ｃ］, 并非, 然而, 4, 它, 长此下去, 纯粹, 五, 正常, 有关, 些, 隔日, 那时, 顿时, 倘, 倍加, ）, 竟, 不经意, 缕缕, 相对, １２％, 怎, 们, ■, ）、, 前后, 哇, 尔尔, 背地里, 呗, 哪年, 社会主义, 同一, 引起, 莫不, 据称, 7, 纵然, ［④ｅ］, ５, 所在, 向使, 不择手段, 极其, ＠, ＝（, ＝－, 那, 以便, 充其极, 孰料, 日复一日, 一., 相似, 只消, 若, 另行, 忽地, ）÷（１－, 共总, 喏, 只怕, 咱, 每, 借以, 真正, ′｜, 或曰, 既是, 嗡嗡, 恰如, 呕, 零, 得出, 宁, 哗, 下列, 切, ，也, 管, 年复一年, 决非, 举凡, 亦, ［②⑤］, ［①］, 格外, 风雨无阻, 一面, 可能, 则甚, ［②ｆ］, 毋宁, 了解, 趁早, 局外, 或是, 二, 不敢, 不可开交, 不由得, ;, 反之亦然, ×, 俺, 如前所述, 人家, 迄, 虽说, 保持, ＝［, ～±, 起初, 才, 曾经, 注意, 川流不息, 大约, 为了, 而言, 深入, ［②ｇ］, 孰知, 前进, 一天, .数, 乘, ｜, 叫做, 当真, 哟, 介于, A, 反过来说, 开展, ［⑨］, 照, 的, ~, 正值, 这个, 是的, 者, 起, 即或, ｃ］, 构成, 日臻, 运用, 非独, 断然, 只要, 一边, 不限, φ, 〕, 顷刻间, 况且, 人, 可是, 以及, 上下, 丰富, 如, 不但...而且, 非得, .一, 饱, ｅ］, 】, 不料, 几番, 敢于, 後来, 可好, 据悉, 出去, 比如说, 不外, 瑟瑟, 无法, 这, 日渐, 即是说, 往往, 似乎, 较为, 看上去, 略, 她的, 哉, 其余, 哼唷, 集中, 大体上, 除此以外, 说说, 因此, 哎, 顶多, 而是, 那里, 绝不, 什么, 立即, 大抵, 既, 话说, 谁料, 以致, ［②ｊ］, 自身, 继而, `, 巨大, 除非, 直接, ［②②］, ５：０, 亲自, 蛮, 尽管, ［①Ｅ］, ［①⑨］, 与其说, 日见, 看出, 昂然, 多年来, 加上, 按理, 应用, 也好, 在于, 尽量, 常言道, 达到, 上, 不仅仅, 从优, 当时, 还, 不仅仅是, 从头, 特别是, 正如, 喂, 立刻, 大致, 依, 归, 呜呼, 就, 独自, 又及, 按期, 它们, 进入, (, 欢迎, 换句话说, 啊呀, 传, ......, 有, 再者说, 受到, 先不先, 三番五次, 大凡, 大量, 得到, 他是, 唯有, 去, 有利, 良好, ！, 皆可, ［③ｄ］, 第, 要求, 成年累月, 云尔, 不仅, 凝神, 好在, 变成, 论说, 反之则, 快, ＝｛, 只有, 诸如, 莫若, sup, 关于, 依照, exp, 再, 这点, 立时, 迅速, 倘或, 之类, 任凭, 练习, 精光, 不对, 今天, 九, 普遍, ＜λ, >>, ［①⑥］, 时候, 再者, 简而言之, 再次, …, 为何, 保险, 例如, 这麽, 加以, 不要, 啊哈, 从古至今, ［－, 基本上, 不起, 里面, ［③ｈ］, 犹且, ⑥, ‘, 姑且, 大体, 你是, 竟然, 不问, 有时, 牢牢, 据, 总的说来, 固然, 那么样, 他的, 双方, 光是, 那般, 以后, 与其, 再说, 每时每刻, 咚, 实际, 挨个, 》, 当庭, 毫无, 假使, 具体来说, 无宁, 不特, ［④ａ］, 如果, ０, 也罢, 绝顶, 进去, ；, 同时, 成心, 两者, 人们, 相反, 是否, 一何, 尔等, 长期以来, 更, 间或, 自己, 到目前为止, 通常, 别人, ［①Ｄ］, …………………………………………………③, 不亦乐乎, 尽心尽力, 自各儿, ［②⑥］, 屡屡, 哪个, 嘎登, 此, 不定, 次第, 各地, ［①ｄ］, 不怎么, 做到, 何, 不知不觉, 得了, 之后, 叮当, 若是, 傥然, ［②⑦］, 恰逢, 省得, ×××, 其, 率尔, 见, ｛－, 纯, 万一, 能, 罢了, 就地, 咳, 相信, 及至, ［, 动辄, 她是, 充分, ［①ｆ］, _, 冒, 那么些, 本人, 取得, #, 上升, ［①⑤］, Lex, 伟大, 具体说来, 逢, =, 八, 拿, 矣, 非徒, 归根到底, 鄙人, 后, Ⅲ, 至今, ……, ［②］, 高低, 除此之外, 该当, 逐渐, 砰, 从中, ［①⑦］, 尽管如此, 起首, 此间, 一番, 主要, Δ, 除却, 了, 不力, 目前, ②ｃ, 相对而言, 切莫, 依靠, ], 嘿嘿, －, 从此, 要不然, 你, 除外, 此时, 长话短说, 周围, 从而, 种, 以前, ＬＩ, ︿, 率然, 向着, 啐, 望, 顷刻, 让, 到头, 结合, 怪不得, 意思, 比及, 恍然, 无, 怎麽, 照着, 后面, 极度, 是不是, 只是, 及, 或多或少, 据说, 平素, 并没有, 即使, 边, ［⑤ａ］, 何必, 使, 甚至, 陡然, ～＋, 自打, 先後, 偏偏, ｛, 动不动, 截然, 儿, 一旦, 部分, ［②ｄ］, 决定, 啊哟, 〈, 除, 一片, 满足, 很少, 作为, 切切, 如上, ＜±, !, 相等, 。, 更加, ［⑧］, 本地, 从新, 她, 不尽然, 诚然, 反手, Ｒ．Ｌ．, 亲身, 以期, 产生, 三番两次, 临, ［①ｉ］, 默默地, 普通, 防止, ., 于是, 哈哈, 具有, 完成, 以至于, 不得了, ［①ｏ］, 差不多, 能否, 5, 谨, 加强, 行动, 突出, ［③ｅ］, 吓, 自从, 比较, 眨眼, 专门, 不尽, 》），, [, 什麽, 臭, ———, 可见, 矣哉, 彼时, 不一, 咧, 另一方面, 当儿, ＄, 谁人, 复杂, 吧哒, 理应, 通过, 尔后, 现代, 且说, 从小, Ａ, 呆呆地, 过来, 哪怕, 像, 巴巴, 谁知, φ．, 贼死, 起头, 现在, 最, 据此, 颇, ＇, 故此, ［②Ｇ］, 老老实实, ⑨, 每年, 乌乎, 白白, ”，, 之, 坚决, 那样, 9, 尚且, ［＊］, ］∧′＝［, 常常, 此外, 刚, 全力, ——, 一则通过, 仍然, 过于, 有力, 自后, 移动, 从, 绝, 怎么, 另外, 放量, 始而, 不怕, 一方面, 兼之, 往, 不已, 并排, 但愿, 交口, 届时, 极了, 属于, 设或, 其他, 比如, 不然的话, 多, 单, 好, 另, 之後, 出现, 任何, 旁人, 方面, 凑巧, ［①ｇ］, 方便, 彻底, 或, 倒是, 各位, ./, 打从, 赶, 上去, 据实, 方才, 许多, 理当, 总而言之, 不得, 喔唷, 各式, 老, ⑤, 尽早, 严格, 便, 看起来, 您, 或者, 宁愿, 乃至, 论, 并不, 及时, 充其量, 当前, 不时, 半, 有著, 联系, 莫如, ＊, 传说, ∈［, 云云, 人民, 已经, 尔, 难怪, 这么些, ［⑩］, 那些, 知道, 虽则, 据我所知, ＃, 一个, 如次, 相当, 正是, 己, 多多益善, 对应, 亲手, 当场, 将才, 必定, 趁, 既然, 初, 成年, 哪里, 限制, ［①①］, 《, 这边, 一时, 大面儿上, ', 喀, 全身心, ＋ξ, 因了, 从宽, 失去, 分期, 针对, ↑, 乃, 为, 连袂, 类如, ［⑤ｆ］, 其一, 背靠背, ＝☆, 古来, ［②Ｂ］, 没有, 几度, 从轻, 连声, 二来, 今後, 而后, １, 甚至于, 换言之, 任务, 联袂, ~~~~, 就此, 碰巧, 每个, 造成, 不能不, ), “, 哪边, 开始, 难说, 向, ［②⑩］, ㈧, 三天两头, 鉴于, 那个, 哗啦, ［④ｂ］, 来, 本身, 赖以, 另悉, 呜, 打开天窗说亮话, 经常, 莫不然, ≈, 七, 近几年来, 而, 和, 当下, 来自, 同样, 不得不, 广大, —, 按, 多亏, 好的, 哪, 8, 尤其, 她们, 吱, 末##末, 彻夜, 略微, 均, 假若, 如此等等, 毫无例外, 您们, 甚么, 嗯, 每每, 待到, 这次, ③, 仅仅, 即若, 再有, 不仅...而且, 简直, ［①⑧］, 大张旗鼓, 单纯, 有的是, 方, 假如, 看看, 一一, 沙沙, 腾, 单单, @, 随着, 立马, ::, 比, 至, 才能, 再则, 马上, 不管, 连日, ＜Δ, ..................., 豁然, 嗳, В, 觉得, 说明, 上面, 忽然, 举行, 并没, 完全, 心里, 宁可, 与否, 使得, 特殊, 嘘, 迟早, 第二, 随后, 多多, 然后, 近来, 它们的, ③］, 把, 所谓, 保管, 奋勇, 借, 不得已, ＆, 除去, 最后, 尽如人意, 得, 后者, 何妨, 那边, 长线, 尽, 密切, 必然, 开外, 不单, 立地, 较, 综上所述, 总之, 一下, 战斗, 说来, 看见, 很, 共同, 然後, ⑦, 归根结底, 大家, 而论, 不会, 趁势, 接著, ２, 任, 从重, 啦, 个别, 如期, 这一来, 愿意, 下来, 不断, 何尝, 这里, ［①Ｃ］, 与"
de,"siebten, mag, es, groß, sonst, zusammen, solcher, demzufolge, eigenen, müssen, gesagt, waren, statt, a, vor, sehr, gewesen, eine, oben, deswegen, dass, niemand, welches, gemacht, wäre, dagegen, wird, wann, bis, bereits, derselbe, dazu, vielen, mir, für, musst, geschweige, dieses, auch, rechte, sechs, wen, bekannt, irgend, heisst, jenen, währenddem, dann, später, könnt, früher, war, gut, weiter, eigenes, welche, gegenüber, manchen, gegen, etwas, muß, zweite, zehntes, seinem, seiner, ich, deiner, seien, dessen, wenige, entweder, darunter, beide, demgemäß, durch, natürlich, meinen, gedurft, hätte, dieselben, fünften, zwischen, sind, und, eben, unsere, siebentes, heißt, viel, fünftes, kleiner, einen, seine, als, habe, konnte, wollte, um, drin, dritter, jedermanns, wohl, seit, neuntes, sollte, ach, mittel, lang, auf, ende, niemanden, mehr, wart, an, sowie, jahren, bin, bald, darfst, gekannt, einmal, infolgedessen, heute, acht, gar, achter, kommt, seid, er, dermassen, ist, zehn, dahinter, dementsprechend, keiner, wenn, zurück, keine, jener, alles, zum, gibt, eigener, ja, siebter, en, ehrlich, müsst, tun, dasein, ein, dadurch, jeden, nahm, durfte, weil, zwei, nun, grossen, nein, sei, mögt, demgemäss, zweites, ihres, den, ihn, gleich, vier, dank, kann, daraus, wollten, mancher, kannst, diejenige, beiden, ag, nicht, dermaßen, muss, mit, andere, darüber, gern, doch, solchem, siebente, jedoch, der, ganzen, würden, aller, meinem, grosser, ausserdem, dort, mensch, vielleicht, unter, gemusst, hätten, uns, zu, einigeeinigen, habt, willst, lieber, keinem, hoch, ganzes, weitere, zehnten, satt, jemanden, dies, menschen, desselben, durften, manchem, weiteren, solches, danach, vierte, eines, welchen, wir, dem, werde, werden, dieser, sagt, wurde, bist, allerdings, erste, gerade, wollt, gab, jedem, sah, tel, zwanzig, na, hier, sechste, weniger, alle, gehen, einander, gross, sechsten, jeder, besonders, gekonnt, demgegenüber, davor, deren, dritte, dürfen, wahr, leicht, eigen, endlich, hatte, ihrem, bisher, dazwischen, viertes, außerdem, wieder, euch, worden, dasselbe, darauf, darum, etwa, anderen, darf, machte, trotzdem, sechster, drei, was, daran, einer, neun, so, kommen, andern, denselben, möchte, würde, selbst, einmaleins, ging, dahin, gemocht, nichts, des, weniges, nachdem, sein, im, rund, richtig, erst, drittes, allen, ihnen, los, wenig, dabei, vergangene, je, große, dein, hat, möglich, achtes, fünfte, kleines, großer, ganz, deine, zweiter, einiger, sollen, zeit, diese, darin, dich, fünfter, allein, jenem, zweiten, dürft, während, noch, kam, vierten, derselben, wirklich, weit, allem, zehnte, vielem, neuen, beispiel, siebte, demselben, grosse, guter, denen, unserer, daß, meines, damals, da, am, deinem, gute, seines, ausser, manche, anders, sich, erstes, weiteres, solche, daher, musste, mich, mein, daselbst, seinen, ob, haben, derjenigen, sieben, diesen, wegen, gott, indem, morgen, besten, ihm, ihre, rechter, aus, wurden, gutes, damit, vom, warum, ersten, wirst, mögen, geht, tag, mussten, á, niemandem, beim, sagte, denn, kaum, dir, ins, du, könnte, währenddessen, hatten, oft, viele, davon, meiner, genug, jetzt, einem, hinter, eigene, man, ohne, wessen, großen, wollen, aber, siebenter, derjenige, unser, schon, neunten, uhr, tagen, dafür, zuerst, solchen, jahre, nach, jemandem, gewollt, leider, die, besser, magst, ebenso, durchaus, grosses, sechstes, mochten, werdet, vierter, neben, von, will, recht, welcher, keinen, nie, großes, einiges, tat, sie, achten, ganzer, solang, teil, über, wer, allgemeinen, manches, geworden, dieselbe, dritten, überhaupt, jenes, jemand, rechtes, immer, her, achte, meine, machen, jedermann, zwar, welchem, kein, siebtes, konnten, ab, nur, jahr, neunte, also, wem, erster, sollten, oder, wie, neue, kleinen, ihrer, vergangenen, seitdem, macht, hast, übrigens, mochte, jene, rechten, können, schlecht, ganze, diesem, hin, wenigstens, zur, sondern, deshalb, siebenten, elf, das, außer, kleine, zunächst, zugleich, offen, neunter, fünf, daneben, zehnter, gehabt, bei, jede, soll, lange, ihr, diejenigen, wo, kurz, in, tage"
nl,"dan, dit, wat, aan, toch, worden, hem, zijn, af, of, tot, alles, dus, iets, nu, door, waren, ja, niets, wezen, was, en, toen, wel, mij, ge, de, met, geen, een, haar, ons, op, reeds, wij, niet, kan, nog, al, zij, zou, als, tegen, te, is, werd, hun, kunnen, zich, iemand, meer, wie, we, mijn, na, men, hier, het, wil, kon, die, zal, om, hebben, ben, me, deze, uw, bij, dat, je, zo, doen, ze, daar, maar, andere, heb, hoe, eens, ook, u, doch, der, zelf, geweest, van, uit, had, moet, heeft, ik, naar, over, veel, altijd, er, omdat, hij, zonder, zei, in, want, voor"
pt,"apontar, cá, se, enquanto, num, foi, tua, porque, vinte, fazia, comprida, cedo, estar, sem, sou, seis, fostes, qual, nível, quanto, somente, outras, eventual, nuns, seu, quinze, desde, através, dez, duas, posição, sexta, certeza, tivestes, quê, estão, nada, neste, estive, caminho, nove, vários, parece, grandes, sobre, dentro, novas, estás, tal, outra, porém, des, dezanove, apenas, temos, mesmo, fazemos, tais, nessa, embora, querem, terceiro, tentar, iniciar, zero, ver, nem, que, essas, breve, ainda, quinto, portanto, nossa, qualquer, possível, próximo, tanta, for, fazem, nossas, ali, pela, lhe, estivemos, estou, forma, nesta, nesse, esses, dão, daquela, fim, faço, porquanto, sabe, segundo, no, tivemos, conhecido, ontem, área, em, maiorias, aquele, deve, conhecida, você, oitavo, tanto, talvez, vossas, agora, elas, demais, por, tiveste, cinco, sétimo, novos, sete, lado, porquê, ao, fazeis, ir, podia, meu, desta, sois, nos, sétima, terceira, quarto, diante, após, apoia, entre, ponto, grande, nunca, da, geral, meses, ambos, te, então, local, coisa, questão, minhas, eles, ela, valor, um, cima, tipo, dessa, ambas, vossa, põem, tente, quatro, cada, vez, todos, dizem, treze, isso, estado, eu, bem, todo, esse, quem, tarde, vos, para, me, já, próprio, mês, é, não, oito, estas, antes, atrás, só, menor, aquilo, isto, final, umas, mal, diz, aí, pelos, lugar, fazer, fora, fomos, quarta, sexto, também, três, era, bastante, dezoito, fará, mas, ademais, inicio, pontos, poderá, tentei, tens, dezasseis, parte, contudo, cuja, tem, fazes, és, nenhuma, dizer, quieta, cujo, possivelmente, de, à, ora, do, essa, tendes, obrigado, tiveram, irá, baixo, corrente, além, minha, primeiro, favor, são, custa, debaixo, estava, os, comprido, as, sei, tentaram, menos, todas, aqui, boa, segunda, aquela, teve, perto, ligado, vais, ter, uma, quando, tuas, foste, estiveste, pode, usa, com, pelo, cento, pegar, meio, vossos, maioria, nossos, certamente, direita, vai, desse, longe, muito, somos, vezes, fui, estes, obrigada, veja, ou, lá, quieto, novo, fez, aqueles, contra, sistema, podem, pois, doze, depois, apoio, quero, primeira, outros, bom, uns, inclusive, suas, ele, aquelas, vinda, dar, números, dezassete, partir, pouca, próxima, muitos, tu, grupo, numa, momento, adeus, nova, estivestes, posso, povo, ser, onde, dá, quais, máximo, está, mil, aos, seus, mais, falta, este, disso, vão, vem, algo, sua, último, conselho, vosso, oitava, como, alguns, vós, quer, teu, nosso, tudo, tempo, teus, pôde, assim, na, acerca, estará, daquele, número, exemplo, põe, sempre, deverá, pelas, vocês, até, sim, logo, seria, devem, tenho, estiveram, poder, vens, algumas, esta, foram, toda, puderam, têm, deste, das, vindo, pouco, sob, catorze, dois, naquele, meus, tive, relação, esteve, tão, quinta, saber, naquela, faz, nós, nas, onze, maior, vêm, dos, usar, às"
hr,"ćeš, njihovo, se, e, tim, mimo, nećete, ikakvoj, bijasmo, doskoro, ikakav, ponekad, uz, tada, biti, nismo, drugdje, biste, doista, će, vašima, nije, sasvim, prije, a, dokle, su, jest, ej, dotad, svoj, gdjekoje, mene, zbog, pak, nisam, ova, al, djelomično, bijaše, hura, tebi, nema, sa, tome, iju, jedna, bih, moja, ikakvog, dosad, čijem, ikakvome, hm, ovoj, tvoje, hoću, eh, željena, njega, naši, im, nju, poimence, ni, naš, svu, svi, ga, nego, njihova, uzagrapce, on, niste, jedni, ikakvom, avaj, svom, iz, je, nama, bijaste, aj, jesmo, htio, u, željah, bio, ikada, pored, zaista, ali, ikakvih, jesi, ono, taj, što, odmah, no, ehe, bar, šta, bi, zatim, oni, koji, bila, ikakvo, joj, ti, eno, jedne, jeste, njemu, bili, htijasmo, da, nakon, s, pljus, htjedoh, te, čijim, bilo, kada, jedno, duž, vrh, htijahu, moje, ikakvi, onu, njezina, sebe, vrlo, jim, kako, njih, dakle, me, budu, hop, nikoga, ćete, zbija, ikakvoga, pa, od, smo, tebe, meni, neke, njezin, njegovo, tvoja, sva, bijahu, za, štogod, hoćemo, sav, njim, ikakve, hoćete, željele, željenu, njegov, hej, vaš, deder, neki, poizdalje, želeći, koja, njima, lani, si, željeli, baš, halo, njoj, evo, vašim, valjda, zum, htjedoste, svog, vama, pouzdano, tvoj, koje, svoje, neće, o, drugamo, ja, nikoje, kao, potajice, moji, de, ikakvima, vjerojatno, željeni, do, kojima, pod, ako, vi, hoće, usprkos, ne, netko, tima, nisi, hoćeš, naša, ju, zar, onoj, aha, one, nad, donekle, njezino, htijaste, bismo, vaše, i, nikoju, budite, podalje, nećemo, nećeš, ah, zimus, željelo, ovaj, nisu, djelomice, šic, sve, vjerovatno, dotle, to, mu, dovečer, sam, jesam, zato, nikoji, nekog, ikakva, daj, ste, onim, arh, željela, njegova, htjele, ovim, našeg, tu, htjedoše, njihov, tvoju, onom, nešto, željen, kroz, mi, ta, potrbuške, uzduž, sebi, željeo, postrance, vas, moju, iako, ona, bez, bijah, dem, brr, svoja, bum, eto, po, moj, nam, bumo, na, ikakvim, budući, ijuju, utaman, vaša, bude, htjela, au, jesu, koju, već, tvoji, ovima, tako, buć, ću, onima, htjeli, neka, dok, željene, budavši, li, samo, ili, još, neću, god, čijima, vam, uvijek, uza, toj, uzalud, štagod, svoju, budimo, ćemo, gic, ih, nas, gdjekakav, neku, jer, naše"
ga,"hocht, ins, lena, faoinár, sibh, cúig, mar, fara, chuig, tar, dó, dar, go, ocht, ina, naoi, ceathair, í, a, ochtar, nócha, seacht, ochtó, haon, seachtó, triúr, de, mo, dá, deichniúr, céad, aon, sinn, trí, don, do, ar, seisear, chun, éis, nó, bhúr, gach, cúigear, ná, is, thú, sa, um, roimh, ní, muid, beirt, dár, os, tríocha, as, ó, ach, arna, den, nach, na, sé, siad, dhá, ceathrar, an, ónár, fiche, inár, seasca, le, deich, sna, i, ag, caoga, tú, naonúr, lenár, gur, iad, faoina, cois, ár, mé, trínár, níor, é, óna, trína, idir, faoi, leis, daichead, seachtar, gan, thar, agus, ba, chomh, sí, dtí, faoin, ón, in"
